{
  "schema_version": "0.3.0",
  "release_version": "0.3.0",
  "profile": "full-creative",
  "project_id": "NINEL",
  "project_format": "series",
  "production_modes": [
    "animation",
    "ai"
  ],
  "units": [
    "NINEL-E01",
    "NINEL-E02"
  ],
  "layers": {
    "story": "story",
    "production": "production",
    "post": "post"
  },
  "validation_status": "valid",
  "unresolved_questions": []
}
